{
  "$schema": "https://json-schema.org/draft/2020-12/schema",
  "$id": "https://akashicnet.org/schemas/cross-source-edge-provenance-v0.1.json",
  "title": "AkashicNET Cross-Source Edge Provenance v0.1",
  "type": "object",
  "required": ["schema_version", "policy", "artifacts", "edges"],
  "additionalProperties": false,
  "properties": {
    "schema_version": {"const": "0.1"},
    "policy": {
      "type": "object",
      "required": [
        "truth_inference_allowed",
        "rights_promotion_allowed",
        "scientific_evidence_promotion_allowed",
        "confidence_from_representation_count_allowed",
        "circular_confidence_allowed"
      ],
      "additionalProperties": false,
      "properties": {
        "truth_inference_allowed": {"const": false},
        "rights_promotion_allowed": {"const": false},
        "scientific_evidence_promotion_allowed": {"const": false},
        "confidence_from_representation_count_allowed": {"const": false},
        "circular_confidence_allowed": {"const": false}
      }
    },
    "artifacts": {
      "type": "array",
      "items": {"$ref": "#/$defs/artifact"}
    },
    "edges": {
      "type": "array",
      "items": {"$ref": "#/$defs/edge"}
    }
  },
  "$defs": {
    "artifact": {
      "type": "object",
      "required": ["artifact_id", "version", "sha256", "source_domain", "independence_key", "public_safe"],
      "additionalProperties": false,
      "properties": {
        "artifact_id": {"type": "string", "minLength": 1},
        "version": {"type": "string", "minLength": 1},
        "sha256": {"type": "string", "pattern": "^[a-f0-9]{64}$"},
        "source_domain": {"type": "string", "minLength": 1},
        "independence_key": {"type": "string", "minLength": 1},
        "public_safe": {"const": true}
      }
    },
    "record_ref": {
      "type": "object",
      "required": ["artifact_id", "record_id"],
      "additionalProperties": false,
      "properties": {
        "artifact_id": {"type": "string", "minLength": 1},
        "record_id": {"type": "string", "minLength": 1}
      }
    },
    "generator": {
      "type": "object",
      "required": ["name", "version", "parameters_digest"],
      "additionalProperties": false,
      "properties": {
        "name": {"type": "string", "minLength": 1},
        "version": {"type": "string", "minLength": 1},
        "parameters_digest": {"type": "string", "pattern": "^[a-f0-9]{64}$"}
      }
    },
    "edge": {
      "type": "object",
      "required": [
        "edge_id", "source", "target", "relationship", "assertion_class",
        "observed_at", "review_state", "accepted_edge", "parent_edge_ids",
        "confidence_source_artifact_ids", "not_truth_claim",
        "not_scientific_evidence", "not_rights_clearance"
      ],
      "additionalProperties": false,
      "properties": {
        "edge_id": {"type": "string", "minLength": 1},
        "source": {"$ref": "#/$defs/record_ref"},
        "target": {"$ref": "#/$defs/record_ref"},
        "relationship": {"type": "string", "minLength": 1},
        "assertion_class": {
          "enum": ["ASSERTED", "DIRECT_METADATA", "INFERRED_CANDIDATE", "HUMAN_ADJUDICATED", "REJECTED_HOLD"]
        },
        "observed_at": {"type": "string", "format": "date-time"},
        "review_state": {"enum": ["PROVISIONAL", "REVIEW_REQUIRED", "HOLD", "REJECTED", "ACCEPTED"]},
        "accepted_edge": {"type": "boolean"},
        "parent_edge_ids": {"type": "array", "uniqueItems": true, "items": {"type": "string", "minLength": 1}},
        "confidence_source_artifact_ids": {"type": "array", "uniqueItems": true, "items": {"type": "string", "minLength": 1}},
        "generator": {"$ref": "#/$defs/generator"},
        "adjudication_ref": {"$ref": "#/$defs/record_ref"},
        "not_truth_claim": {"const": true},
        "not_scientific_evidence": {"const": true},
        "not_rights_clearance": {"const": true}
      }
    }
  }
}
